{
  "schema": "minivac.probe/1",
  "id": "AT-06",
  "source": "components.md §8.2 AT-06; architecture §13.4.3",
  "profile": "MV601-REF-A",
  "cases": [{
    "k": "machine", "name": "dead-short",
    "source": { "k": "scenario", "wires": ["1+/1-"], "actions": [
      { "k": "do", "cmd": { "k": "power", "on": true } },
      { "k": "advance", "ticks": 1 },
      { "k": "advance", "ticks": 1 }
    ] },
    "checkpoints": [
      { "name": "first-boundary", "at": { "k": "action", "actionIndex": 1, "actionKind": "advance" }, "checks": [
        { "k": "near", "name": "dead-short-current", "read": { "k": "state", "field": "supplyUa" }, "expected": 19402985, "tolerance": 100000 },
        { "k": "bool", "name": "breaker-clear", "read": { "k": "stateBool", "field": "breakerTripped" }, "expected": false }
      ] },
      { "name": "trip-boundary", "at": { "k": "action", "actionIndex": 2, "actionKind": "advance" }, "checks": [
        { "k": "bool", "name": "breaker-tripped", "read": { "k": "stateBool", "field": "breakerTripped" }, "expected": true },
        { "k": "compare", "name": "rail-zero", "left": { "k": "state", "field": "railMv" }, "op": "eq", "right": { "k": "literal", "value": 0 } },
        { "k": "eventSeen", "name": "trip-seen", "event": { "k": "breaker.trip" }, "expected": true }
      ] }
    ]
  }]
}
