{
  "schema": "minivac.probe/1",
  "id": "AT-10",
  "source": "BK1 printed p.22 = book1.pdf PDF p.24; components.md §8.2 AT-10",
  "profile": "MV601-REF-A",
  "cases": [
    { "k": "machine", "name": "stop-short", "source": { "k": "scenario", "wires": ["1+/D17", "1-/D18", "D18/D19"], "actions": [
      { "k": "do", "cmd": { "k": "power", "on": true } }, { "k": "settle", "maxTicks": 5000 }
    ] }, "checkpoints": [{ "name": "settled", "at": { "k": "action", "actionIndex": 1, "actionKind": "settle" }, "checks": [
      { "k": "near", "name": "limited-current", "read": { "k": "state", "field": "supplyUa" }, "expected": 550000, "tolerance": 50000 },
      { "k": "compare", "name": "below-trip", "left": { "k": "state", "field": "supplyUa" }, "op": "lt", "right": { "k": "profile", "field": "ITripUa" } },
      { "k": "bool", "name": "breaker-clear", "read": { "k": "stateBool", "field": "breakerTripped" }, "expected": false }
    ] }] },
    { "k": "machine", "name": "dead-short", "source": { "k": "scenario", "wires": ["1+/1-"], "actions": [
      { "k": "do", "cmd": { "k": "power", "on": true } }, { "k": "advance", "ticks": 2000 }
    ] }, "checkpoints": [{ "name": "trip-boundary", "at": { "k": "action", "actionIndex": 1, "actionKind": "advance" }, "checks": [
      { "k": "bool", "name": "breaker-tripped", "read": { "k": "stateBool", "field": "breakerTripped" }, "expected": true },
      { "k": "eventSeen", "name": "trip-seen", "event": { "k": "breaker.trip" }, "expected": true }
    ] }] }
  ]
}
