{
  "schema": "minivac.probe/1",
  "id": "AT-01",
  "source": "BK1 printed p.17 = book1.pdf PDF p.19; components.md §8.2 AT-01",
  "profile": "MV601-REF-A",
  "cases": [{
    "k": "machine",
    "name": "i-exp9-latch",
    "source": {
      "k": "scenario",
      "wires": ["1F/1-", "1C/1X", "1Y/2Y", "2Y/2+", "2Z/1L", "1K/1C"],
      "actions": [
        { "k": "do", "cmd": { "k": "power", "on": true } },
        { "k": "do", "cmd": { "k": "button", "n": 1, "target": 1000 } },
        { "k": "settle", "maxTicks": 5000 },
        { "k": "do", "cmd": { "k": "button", "n": 1, "target": 0 } },
        { "k": "settle", "maxTicks": 5000 },
        { "k": "advance", "ticks": 2000 }
      ]
    },
    "checkpoints": [{
      "name": "latched-after-release",
      "at": { "k": "action", "actionIndex": 5, "actionKind": "advance" },
      "checks": [
        { "k": "near", "name": "coil-voltage", "read": { "k": "terminalPairMv", "a": "1E", "b": "1F" }, "expected": 6920, "tolerance": 100 },
        { "k": "compare", "name": "relay-operated", "left": { "k": "relay", "n": 1, "field": "travel" }, "op": "eq", "right": { "k": "literal", "value": 1000 } },
        { "k": "compare", "name": "holds-above-dropout", "left": { "k": "relay", "n": 1, "field": "coilUa" }, "op": "gt", "right": { "k": "relay", "n": 1, "field": "dropOutUa" } },
        { "k": "eventSeen", "name": "pullin-seen", "event": { "k": "relay.pullIn", "n": 1 }, "expected": true }
      ]
    }]
  }]
}
