{
  "schema": "minivac.probe/1",
  "id": "AT-07",
  "source": "BK1 printed pp.14-15 = book1.pdf PDF pp.16-17; components.md §8.2 AT-07",
  "profile": "MV601-REF-A",
  "cases": [
    { "k": "machine", "name": "e-fed", "source": { "k": "fixture", "fixture": "I-EXP7" }, "checkpoints": [{
      "name": "after-e-fed", "at": { "k": "fixtureStep", "scriptIndex": 5, "stepKind": "advance" }, "checks": [
        { "k": "compare", "name": "relay-operated", "left": { "k": "relay", "n": 1, "field": "travel" }, "op": "eq", "right": { "k": "literal", "value": 1000 } },
        { "k": "near", "name": "indicator-dark", "read": { "k": "relay", "n": 1, "field": "indicatorUa" }, "expected": 0, "tolerance": 10 }
      ]
    }] },
    { "k": "machine", "name": "c-fed", "source": { "k": "fixture", "fixture": "I-EXP7" }, "checkpoints": [{
      "name": "after-c-fed", "at": { "k": "fixtureStep", "scriptIndex": 16, "stepKind": "advance" }, "checks": [
        { "k": "compare", "name": "relay-operated", "left": { "k": "relay", "n": 1, "field": "travel" }, "op": "eq", "right": { "k": "literal", "value": 1000 } },
        { "k": "compare", "name": "indicator-equals-coil", "left": { "k": "relay", "n": 1, "field": "indicatorUa" }, "op": "eq", "right": { "k": "relay", "n": 1, "field": "coilUa" } },
        { "k": "near", "name": "indicator-brightness", "read": { "k": "lamp", "kind": "ind", "n": 1, "field": "milli" }, "expected": 749, "tolerance": 10 },
        { "k": "compare", "name": "indicator-lit", "left": { "k": "lamp", "kind": "ind", "n": 1, "field": "milli" }, "op": "ge", "right": { "k": "literal", "value": 150 } },
        { "k": "compare", "name": "holds-above-dropout", "left": { "k": "relay", "n": 1, "field": "coilUa" }, "op": "gt", "right": { "k": "relay", "n": 1, "field": "dropOutUa" } }
      ]
    }] }
  ]
}
