{
  "schema": "minivac.probe/1",
  "id": "AT-04",
  "source": "BK7 printed pp.8-9; components.md §8.2 AT-04",
  "profile": "MV601-REF-A",
  "cases": [
    { "k": "machine", "name": "r180", "source": { "k": "scenario", "wires": ["1F/1-"], "actions": [{ "k": "do", "cmd": { "k": "connect", "cord": 1, "a": { "k": "hole", "hole": "1+#1" }, "b": { "k": "hole", "hole": "1E#1" }, "r_uohm": 180000000 } }, { "k": "do", "cmd": { "k": "power", "on": true } }, { "k": "settle", "maxTicks": 5000 }] }, "checkpoints": [{ "name": "settled", "at": { "k": "action", "actionIndex": 2, "actionKind": "settle" }, "checks": [{ "k": "compare", "name": "above-dropout", "left": { "k": "relay", "n": 1, "field": "coilUa" }, "op": "gt", "right": { "k": "profile", "field": "dropOutUa" } }, { "k": "compare", "name": "below-pullin", "left": { "k": "relay", "n": 1, "field": "coilUa" }, "op": "lt", "right": { "k": "profile", "field": "pullInUa" } }] }] },
    { "k": "machine", "name": "r220", "source": { "k": "scenario", "wires": ["1F/1-"], "actions": [{ "k": "do", "cmd": { "k": "connect", "cord": 1, "a": { "k": "hole", "hole": "1+#1" }, "b": { "k": "hole", "hole": "1E#1" }, "r_uohm": 220000000 } }, { "k": "do", "cmd": { "k": "power", "on": true } }, { "k": "settle", "maxTicks": 5000 }] }, "checkpoints": [{ "name": "settled", "at": { "k": "action", "actionIndex": 2, "actionKind": "settle" }, "checks": [{ "k": "compare", "name": "above-dropout", "left": { "k": "relay", "n": 1, "field": "coilUa" }, "op": "gt", "right": { "k": "profile", "field": "dropOutUa" } }, { "k": "compare", "name": "below-pullin", "left": { "k": "relay", "n": 1, "field": "coilUa" }, "op": "lt", "right": { "k": "profile", "field": "pullInUa" } }] }] },
    { "k": "machine", "name": "r270", "source": { "k": "scenario", "wires": ["1F/1-"], "actions": [{ "k": "do", "cmd": { "k": "connect", "cord": 1, "a": { "k": "hole", "hole": "1+#1" }, "b": { "k": "hole", "hole": "1E#1" }, "r_uohm": 270000000 } }, { "k": "do", "cmd": { "k": "power", "on": true } }, { "k": "settle", "maxTicks": 5000 }] }, "checkpoints": [{ "name": "settled", "at": { "k": "action", "actionIndex": 2, "actionKind": "settle" }, "checks": [{ "k": "compare", "name": "above-dropout", "left": { "k": "relay", "n": 1, "field": "coilUa" }, "op": "gt", "right": { "k": "profile", "field": "dropOutUa" } }, { "k": "compare", "name": "below-pullin", "left": { "k": "relay", "n": 1, "field": "coilUa" }, "op": "lt", "right": { "k": "profile", "field": "pullInUa" } }] }] },
    { "k": "machine", "name": "r330", "source": { "k": "scenario", "wires": ["1F/1-"], "actions": [{ "k": "do", "cmd": { "k": "connect", "cord": 1, "a": { "k": "hole", "hole": "1+#1" }, "b": { "k": "hole", "hole": "1E#1" }, "r_uohm": 330000000 } }, { "k": "do", "cmd": { "k": "power", "on": true } }, { "k": "settle", "maxTicks": 5000 }] }, "checkpoints": [{ "name": "settled", "at": { "k": "action", "actionIndex": 2, "actionKind": "settle" }, "checks": [{ "k": "compare", "name": "above-dropout", "left": { "k": "relay", "n": 1, "field": "coilUa" }, "op": "gt", "right": { "k": "profile", "field": "dropOutUa" } }, { "k": "compare", "name": "below-pullin", "left": { "k": "relay", "n": 1, "field": "coilUa" }, "op": "lt", "right": { "k": "profile", "field": "pullInUa" } }] }] },
    { "k": "machine", "name": "r390", "source": { "k": "scenario", "wires": ["1F/1-"], "actions": [{ "k": "do", "cmd": { "k": "connect", "cord": 1, "a": { "k": "hole", "hole": "1+#1" }, "b": { "k": "hole", "hole": "1E#1" }, "r_uohm": 390000000 } }, { "k": "do", "cmd": { "k": "power", "on": true } }, { "k": "settle", "maxTicks": 5000 }] }, "checkpoints": [{ "name": "settled", "at": { "k": "action", "actionIndex": 2, "actionKind": "settle" }, "checks": [{ "k": "compare", "name": "above-dropout", "left": { "k": "relay", "n": 1, "field": "coilUa" }, "op": "gt", "right": { "k": "profile", "field": "dropOutUa" } }, { "k": "compare", "name": "below-pullin", "left": { "k": "relay", "n": 1, "field": "coilUa" }, "op": "lt", "right": { "k": "profile", "field": "pullInUa" } }] }] },
    { "k": "machine", "name": "r470", "source": { "k": "scenario", "wires": ["1F/1-"], "actions": [{ "k": "do", "cmd": { "k": "connect", "cord": 1, "a": { "k": "hole", "hole": "1+#1" }, "b": { "k": "hole", "hole": "1E#1" }, "r_uohm": 470000000 } }, { "k": "do", "cmd": { "k": "power", "on": true } }, { "k": "settle", "maxTicks": 5000 }] }, "checkpoints": [{ "name": "settled", "at": { "k": "action", "actionIndex": 2, "actionKind": "settle" }, "checks": [{ "k": "compare", "name": "above-dropout", "left": { "k": "relay", "n": 1, "field": "coilUa" }, "op": "gt", "right": { "k": "profile", "field": "dropOutUa" } }, { "k": "compare", "name": "below-pullin", "left": { "k": "relay", "n": 1, "field": "coilUa" }, "op": "lt", "right": { "k": "profile", "field": "pullInUa" } }] }] },
    { "k": "machine", "name": "r120", "source": { "k": "scenario", "wires": ["1F/1-"], "actions": [{ "k": "do", "cmd": { "k": "connect", "cord": 1, "a": { "k": "hole", "hole": "1+#1" }, "b": { "k": "hole", "hole": "1E#1" }, "r_uohm": 120000000 } }, { "k": "do", "cmd": { "k": "power", "on": true } }, { "k": "settle", "maxTicks": 5000 }] }, "checkpoints": [{ "name": "settled", "at": { "k": "action", "actionIndex": 2, "actionKind": "settle" }, "checks": [{ "k": "compare", "name": "at-or-above-pullin", "left": { "k": "relay", "n": 1, "field": "coilUa" }, "op": "ge", "right": { "k": "profile", "field": "pullInUa" } }] }] },
    { "k": "machine", "name": "r150", "source": { "k": "scenario", "wires": ["1F/1-"], "actions": [{ "k": "do", "cmd": { "k": "connect", "cord": 1, "a": { "k": "hole", "hole": "1+#1" }, "b": { "k": "hole", "hole": "1E#1" }, "r_uohm": 150000000 } }, { "k": "do", "cmd": { "k": "power", "on": true } }, { "k": "settle", "maxTicks": 5000 }] }, "checkpoints": [{ "name": "settled", "at": { "k": "action", "actionIndex": 2, "actionKind": "settle" }, "checks": [{ "k": "near", "name": "near-nominal-pullin", "read": { "k": "relay", "n": 1, "field": "coilUa" }, "expected": 43333, "tolerance": 200 }] }] }
  ]
}
