{
  "schema": "minivac.probe/1",
  "id": "AT-09",
  "source": "components.md §7.2 and §8.2 AT-09",
  "profile": "MV601-REF-A",
  "modeledSubstitutions": [{
    "k": "modeledObservableSubstitution",
    "claim": "Breaker trip extinguishes the POWER lamp until reset",
    "model": "breakerTripped && railMv == 0; after reset !breakerTripped && railMv > 0",
    "status": "unverified",
    "sourceEquivalent": false
  }],
  "cases": [{
    "k": "machine", "name": "trip-and-reset",
    "source": { "k": "scenario", "wires": ["1+/1-"], "actions": [
      { "k": "do", "cmd": { "k": "power", "on": true } },
      { "k": "advance", "ticks": 2000 },
      { "k": "do", "cmd": { "k": "disconnect", "cord": 0 } },
      { "k": "do", "cmd": { "k": "breaker", "reset": true } },
      { "k": "settle", "maxTicks": 5000 }
    ] },
    "checkpoints": [
      { "name": "power-substitute-off", "at": { "k": "action", "actionIndex": 1, "actionKind": "advance" }, "checks": [
        { "k": "bool", "name": "breaker-tripped", "read": { "k": "stateBool", "field": "breakerTripped" }, "expected": true },
        { "k": "compare", "name": "rail-zero", "left": { "k": "state", "field": "railMv" }, "op": "eq", "right": { "k": "literal", "value": 0 } }
      ] },
      { "name": "power-substitute-restored", "at": { "k": "action", "actionIndex": 4, "actionKind": "settle" }, "checks": [
        { "k": "bool", "name": "breaker-clear", "read": { "k": "stateBool", "field": "breakerTripped" }, "expected": false },
        { "k": "compare", "name": "rail-positive", "left": { "k": "state", "field": "railMv" }, "op": "gt", "right": { "k": "literal", "value": 0 } }
      ] }
    ]
  }]
}
